<?xml version="1.0" encoding="UTF-8"?>
<!ELEMENT books (book*)>
<!ELEMENT book (id+,name+,author+,date+)>
<!ELEMENT id (#PCDATA)>
<!ELEMENT name (#PCDATA)>
<!ELEMENT author (#PCDATA)>
<!ELEMENT date (#PCDATA)>